{
    "resourceType": "Bundle",
    "id": "56e9d7db-d70a-48bf-95f8-e779a741382a",
    "type": "history",
    "timestamp": "2020-06-01T13:00:00Z",
    "entry": [
      {
        "fullUrl": "urn:uuid:56e9d7db-d70a-48bf-95f8-e779a741382a",
        "resource": {
          "resourceType": "Parameters",
          "meta": {
            "profile": [
              "http://hl7.org/fhir/uv/subscriptions-backport/StructureDefinition/backport-subscription-status-r4"
            ]
          },
          "id": "56e9d7db-d70a-48bf-95f8-e779a741382a",
          "parameter": [
            {
              "name": "subscription",
              "valueReference": {
                "reference": "https://api.service.nhs.uk/multicast-notification-service/subscriptions"
              }
            },
            {
              "name": "status",
              "valueCode": "active"
            },
            {
              "name": "type",
              "valueCode": "event-notification"
            },
            {
              "name": "notification-event",
              "part": [
                {
                  "name": "event-number",
                  "valueString": "1"
                },
                {
                  "name": "timestamp",
                  "valueInstant": "2020-06-01T13:00:00Z"
                },
                {
                  "name": "focus",
                  "valueReference": {
                    "reference": "https://api.service.nhs.uk/personal-demographics/FHIR/R4/Patient/9912003888"
                  }
                }
              ]
            },
            {
              "name": "additional-context",
              "part": [
                {
                  "name": "event-type",
                  "valueString": "pds-change-of-gp-2"
                },
                {
                  "name": "source",
                  "valueUri": "https://fhir.nhs.uk/Id/nhsSpineASID/477121000324"
                },
                {
                  "name": "subject",
                  "valueReference": {
                    "identifier": {
                      "value": "9912003888"
                    }
                  }
                }
              ]
            }
          ]
        },
        "request": {
          "method": "GET",
          "url": "https://api.service.nhs.uk/multicast-notification-service/subscriptions"
        },
        "response": {
          "status": "200"
        }
      }
    ]
  }
  