{
    "resourceType": "Bundle",
    "id": "236a1d4a-5d69-4fa9-9c7f-e72bf505aa5b",
    "type": "history",
    "timestamp": "2020-06-01T13:00:00Z",
    "entry": [
      {
        "fullUrl": "urn:uuid:236a1d4a-5d69-4fa9-9c7f-e72bf505aa5b",
        "resource": {
          "resourceType": "Parameters",
          "meta": {
            "profile": [
              "http://hl7.org/fhir/uv/subscriptions-backport/StructureDefinition/backport-subscription-status-r4"
            ]
          },
          "id": "236a1d4a-5d69-4fa9-9c7f-e72bf505aa5b",
          "parameter": [
            {
              "name": "subscription",
              "valueReference": {
                "reference": "https://api.service.nhs.uk/multicast-notification-service/subscriptions"
              }
            },
            {
              "name": "status",
              "valueCode": "active"
            },
            {
              "name": "type",
              "valueCode": "event-notification"
            },
            {
              "name": "notification-event",
              "part": [
                {
                  "name": "event-number",
                  "valueString": "1"
                },
                {
                  "name": "timestamp",
                  "valueInstant": "2020-06-01T13:00:00Z"
                },
                {
                  "name": "focus",
                  "valueReference": {
                    "reference": "https://api.service.nhs.uk/patient-data-manager/FHIR/R4/Bundle/b0b97bff-e3d7-4744-a09a-e55781886dd0"
                  }
                }
              ]
            },
            {
              "name": "additional-context",
              "part": [
                {
                  "name": "event-type",
                  "valueString": "pathology-laboratory-reporting-test-result-stored-1"
                },
                {
                  "name": "source",
                  "valueUri": "uk.nhs.pathology-laboratory-reporting"
                },
                {
                  "name": "subject",
                  "valueReference": {
                    "identifier": {
                      "value": "9912003888"
                    }
                  }
                }
              ]
            }
          ]
        },
        "request": {
          "method": "GET",
          "url": "https://api.service.nhs.uk/multicast-notification-service/subscriptions"
        },
        "response": {
          "status": "200"
        }
      }
    ]
  }
