{
  "resourceType": "Bundle",
  "id": "4fa82e1f-cd61-474f-84f9-df9760663d75",
  "type": "history",
  "timestamp": "2026-02-26T17:35:41.104058+00:00",
  "entry": [
    {
      "fullUrl": "urn:uuid:b807295a-0a58-4189-8a3d-948c912c4bb5",
      "resource": {
        "resourceType": "Parameters",
        "meta": {
          "profile": [
            "http://hl7.org/fhir/uv/subscriptions-backport/StructureDefinition/backport-subscription-status-r4"
          ]
        },
        "id": "b807295a-0a58-4189-8a3d-948c912c4bb5",
        "parameter": [
          {
            "name": "subscription",
            "valueReference": {
              "reference": "https://api.service.nhs.uk/multicast-notification-service/subscriptions"
            }
          },
          {
            "name": "status",
            "valueCode": "active"
          },
          {
            "name": "type",
            "valueCode": "event-notification"
          },
          {
            "name": "notification-event",
            "part": [
              {
                "name": "event-number",
                "valueString": "1"
              },
              {
                "name": "timestamp",
                "valueInstant": "2026-02-26T17:35:41.104058+00:00"
              },
              {
                "name": "focus",
                "valueReference": {
                  "reference": "https://int.api.service.nhs.uk/patient-data-manager/FHIR/R4/Composition/b0b97bff-e3d7-4744-a09a-e55781886dd0/$document"
                }
              }
            ]
          },
          {
            "name": "additional-context",
            "part": [
              {
                "name": "event-type",
                "valueString": "nhshco-hc-complete-1"
              },
              {
                "name": "source",
                "valueUri": "uk.nhs.nhs-health-check-online"
              },
              {
                "name": "subject",
                "valueReference": {
                  "identifier": {
                    "value": "9912003888"
                  }
                }
              }
            ]
          }
        ]
      },
      "request": {
        "method": "GET",
        "url": "https://api.service.nhs.uk/multicast-notification-service/subscriptions"
      },
      "response": {
        "status": "200"
      }
    }
  ]
}
