{
  "resourceType": "Bundle",
  "id": "236a1d4a-5d69-4fa9-9c7f-e72bf505aa5b",
  "type": "history",
  "timestamp": "2020-06-01T13:00:00Z",
  "entry": [
    {
      "fullUrl": "urn:uuid:9155bdda-35c9-44d0-a772-37abd7870e5c",
      "resource": {
        "resourceType": "Parameters",
        "meta": {
          "profile": [
            "http://hl7.org/fhir/uv/subscriptions-backport/StructureDefinition/backport-subscription-status-r4"
          ]
        },
        "id": "9155bdda-35c9-44d0-a772-37abd7870e5c",
        "parameter": [
          {
            "name": "subscription",
            "valueReference": {
              "reference": "https://api.service.nhs.uk/multicast-notification-service/subscriptions"
            }
          },
          {
            "name": "status",
            "valueCode": "active"
          },
          {
            "name": "type",
            "valueCode": "event-notification"
          },
          {
            "name": "notification-event",
            "part": [
              {
                "name": "event-number",
                "valueString": "1"
              },
              {
                "name": "timestamp",
                "valueInstant": "2020-06-01T13:00:00Z"
              },
              {
                "name": "focus",
                "valueReference": {
                  "reference": "https://api.service.nhs.uk/register-with-a-gp-surgery?sessionID=bd468854-4cd5-4e57-9dde-e5a482d50605"
                }
              }
            ]
          },
          {
            "name": "additional-context",
            "part": [
              {
                "name": "event-type",
                "valueString": "gpreg-change-gp-req-1"
              },
              {
                "name": "source",
                "valueUri": "uk.nhs.register-with-a-gp-surgery"
              },
              {
                "name": "subject",
                "valueReference": {
                  "identifier": {
                    "value": "9912003888"
                  }
                }
              }
            ]
          }
        ]
      },
      "request": {
        "method": "GET",
        "url": "https://api.service.nhs.uk/multicast-notification-service/subscriptions"
      },
      "response": {
        "status": "200"
      }
    }
  ]
}
